{
  "schemaVersion": "1",
  "tool": {
    "name": "demo",
    "version": "0.0.0"
  },
  "formatShorthands": {},
  "schemas": [],
  "commands": [
    {
      "id": "greet",
      "path": ["greet"],
      "description": "Say hello",
      "usage": "demo greet [options]",
      "arguments": [],
      "options": [
        {
          "name": "--name",
          "aliases": ["-n"],
          "description": "Who to greet",
          "valueName": "name",
          "arity": { "min": 1, "max": 1 },
          "required": false,
          "negatable": false,
          "valueType": "string",
          "allowedValues": null,
          "recursive": false
        }
      ],
      "subcommands": [],
      "formats": null,
      "defaultFormat": null,
      "formatConfigurable": false,
      "outputSchema": null,
      "exitCodes": [],
      "stream": null,
      "writes": null,
      "stability": "undeclared"
    }
  ]
}
